{
  "schemaVersion": 2,
  "workshop": {
    "slug": "contract-fixture",
    "title": "Workshop contract fixture",
    "summary": "A minimal hydrated v2 manifest used to detect contract drift.",
    "prerequisites": [
      "A browser"
    ],
    "attribution": {
      "title": "Intar contract fixture",
      "url": "https://intar.dev/",
      "license": "MIT"
    },
    "defaultLobbyMinutes": 30
  },
  "workspace": {
    "leaseGraceMinutes": 60,
    "vms": [
      {
        "id": "learner",
        "name": "learner",
        "cpuMillis": 4000,
        "memoryMib": 16384,
        "diskMib": 32768
      }
    ],
    "runtimeProfiles": [
      {
        "id": "gcp-e2-standard-4",
        "provider": "gcp_compute",
        "vmId": "learner",
        "machineType": "e2-standard-4",
        "requestedSystemImage": "projects/debian-cloud/global/images/family/debian-13",
        "immutableSystemImage": "projects/debian-cloud/global/images/debian-13-20260701",
        "rootDiskType": "pd-balanced",
        "locations": [
          "europe-west3-a"
        ],
        "hardware": {
          "architecture": "x86_64",
          "cpuMillis": 4000,
          "providerCpuCount": 4,
          "memoryMib": 16384,
          "diskMib": 32768
        }
      }
    ],
    "checkpoints": [
      {
        "id": "00",
        "label": "Checkpoint 00",
        "vmImages": [
          {
            "vmId": "learner",
            "imageKey": {
              "scenario": "contract-fixture-00",
              "vm": "learner",
              "arch": "x86_64"
            },
            "imageSha256": "aaaaaaaaaaaaaaaaaaaaaaaaaaaaaaaaaaaaaaaaaaaaaaaaaaaaaaaaaaaaaaaa"
          }
        ]
      }
    ],
    "initialCheckpointId": "00",
    "applications": [
      {
        "id": "console",
        "label": "Console",
        "vmId": "learner",
        "port": 8080,
        "protocol": "http",
        "upstreamHost": "127.0.0.1",
        "releaseModuleId": "00"
      }
    ]
  },
  "modules": [
    {
      "id": "00",
      "title": "Setup",
      "tier": "gate",
      "outcome": "The workspace is ready.",
      "dependsOn": [],
      "participantMarkdown": "# Setup\n",
      "facilitatorNotesMarkdown": "Watch for readiness.\n",
      "hints": [
        {
          "id": "00-hint-01",
          "title": "Check readiness",
          "bodyMarkdown": "Run the verifier.\n"
        }
      ],
      "solutionMarkdown": "Run the setup script.\n",
      "explainBackPrompt": "What became ready?",
      "probeIds": [
        "workspace-ready"
      ],
      "catchUpCheckpointId": "00"
    }
  ],
  "agenda": [
    {
      "id": "setup",
      "kind": "lab",
      "title": "Setup",
      "durationMinutes": 15,
      "scheduled": true,
      "moduleId": "00",
      "slideIds": [
        "setup"
      ],
      "release": "facilitator"
    }
  ],
  "presentation": {
    "slides": [
      {
        "id": "setup",
        "layout": "content",
        "title": "Setup",
        "bodyMarkdown": "# Setup\n",
        "notesMarkdown": "Introduce the environment.\n",
        "moduleId": "00"
      }
    ]
  },
  "durationMinutes": 15
}
